Ana Kategori;Alt Kategori;Marka;Ürün Adı;Fiyat;Resim URL;Sosyal Kanıt (Favori);Yıldız;Yorum Sayısı
"Erkek";"Erkek Çanta";"Linatigers";"Unisex Siyah Usb Kulaklık Çıkışlı Omuz Çantası Çapraz Askılı Göğüs Çanta";"442,83 TL";"https://cdn.dsmcdn.com/mnresize/400/-/ty1377/product/media/images/prod/QC/20240624/12/ad04ad68-5f38-360c-a2f0-b9020669dcc7/1_org_zoom.jpg";"Hızlı teslimat yapılıyor!";"4.7";"1624"
"Erkek";"Erkek Çanta";"JR Boutique";"Erkek El Çantası Suni Deri Çift Saplı Günlük El Portföyü - Siyah Çok Amaçlı El Çantası";"364,12 TL";"https://cdn.dsmcdn.com/mnresize/400/-/ty1830/prod/QC_PREP/20260301/10/792de6fa-9a3e-3883-a71c-4164c3cae47c/1_org_zoom.jpg";"En Çok Satan 3. Ürün";"3";"18"
"Erkek";"Erkek Çanta";"Valiberta";"Çift Kulplu Deri Görünümlü Erkek El Çantası - Siyah";"438,11 TL";"https://cdn.dsmcdn.com/mnresize/400/-/ty1711/prod/QC_ENRICHMENT/20250717/12/620f8a5a-f004-3d8c-a8bb-5cfda482c423/1_org_zoom.jpg";"En Çok Satan 2. Ürün";"2";"144"
"Erkek";"Erkek Çanta";"Av A Dos";"Unisex Impertex Kumaş Telefon Bölmeli Bel Ve Çapraz Omuz Çanta Göğüs Seyahet Günlük Bodybag";"399,80 TL";"https://cdn.dsmcdn.com/mnresize/400/-/ty1409/product/media/images/prod/QC/20240708/20/15bad5f4-2b35-366e-8800-fbba360a9531/1_org_zoom.jpg";"En Çok Satan 2. Ürün";"4.6";"777"
"Erkek";"Erkek Çanta";"Arctic Hunter";"Omuz Göğüs Ve Kol Çantası Çok Amaçlı Suya Dayanıklı Premium Ultra Hafif Şık Çanta";"1.031,96 TL";"https://cdn.dsmcdn.com/mnresize/400/-/ty1711/prod/QC_ENRICHMENT/20250717/04/17921547-10d6-3311-8822-2cb0ba9cd214/1_org_zoom.jpg";"Videolu Ürün";"5.0";"4"
"Erkek";"Erkek Çanta";"D'VERS";"Su Geçirmez Siyah Deri Çapraz Askılı Omuz ve Bel Çantası";"469,90 TL";"https://cdn.dsmcdn.com/mnresize/400/-/ty1593/prod/QC/20241028/03/403383cd-0d36-3911-baf4-6d613202faf6/1_org_zoom.jpg";"En Çok Ziyaret Edilen 4. Ürün";"4.7";"1176"
"Erkek";"Erkek Çanta";"JR Boutique";"Erkek El Çantası 3 Bölmeli Slim Portföy-Çıkarılabilir Askılı Suni Deri Clutch Cüzdan";"361,19 TL";"https://cdn.dsmcdn.com/mnresize/400/-/ty1830/prod/QC_PREP/20260301/10/c1f7aa90-bb0d-30ec-a165-a6af8399ed55/1_org_zoom.jpg";"En Çok Satan 8. Ürün";"2";"26"
"Erkek";"Erkek Çanta";"the modawest";"Unisex Siyah 2 Bölmeli Bel ve Omuz Çantası";"179 TL";"https://cdn.dsmcdn.com/mnresize/400/-/ty1858/prod/QC_PREP/20260425/02/0ea19e8d-d706-30c2-94cc-4f37453b4a3f/1_org_zoom.jpg";"En Çok Satan 1. Ürün";"2";"3"
"Erkek";"Erkek Çanta";"AVCA";"Unisex Oxfort Kumaş Telefon Bölmeli Bel Ve Çapraz Omuz Çanta Göğüs Seyahet Günlük Bodybag";"371,43 TL";"https://cdn.dsmcdn.com/mnresize/400/-/ty1506/product/media/images/prod/QC/20240827/18/1327d788-613f-3703-b35a-d7b70d525897/1_org_zoom.jpg";"Videolu Ürün";"4.5";"185"
"Erkek";"Erkek Çanta";"D'VERS";"Su İtici Kumaş ve Fermuar Özellikli Siyah Çapraz Askılı Omuz ve Bel Çantası";"474,90 TL";"https://cdn.dsmcdn.com/mnresize/400/-/ty1647/prod/QC/20250307/11/7346b87d-011b-3310-96db-fc51e9e6a33b/1_org_zoom.jpg";"En Çok Satan 4. Ürün";"4.7";"666"
"Erkek";"Erkek Çanta";"LOOP DESIGN";"Unısex Çok Renkli Freebag Bel & Omuz Çantası – Fonksiyonel ve Şehir Stiline Uyumlu";"474,78 TL";"https://cdn.dsmcdn.com/mnresize/400/-/ty1826/prod/QC_PREP/20260214/16/29161927-a627-3291-9f09-856ffa9993a3/1_org_zoom.jpg";"Hızlı teslimat yapılıyor!";"4";"23"
"Erkek";"Erkek Çanta";"tuldar";"Erkek Siyah Hakiki Deri Telefon Cüzdan Bölmeli Usb Kulaklık Çıkışlı Çapraz Göğüs Ve Omuz Çantası";"429,70 TL";"https://cdn.dsmcdn.com/mnresize/400/-/ty1538/product/media/images/ty1538/prod/QC/20240912/11/04651ab1-e15d-3aa2-bf8a-00cb1c648c70/1_org_zoom.jpg";"Hızlı teslimat yapılıyor!";"4";"374"
"Erkek";"Erkek Çanta";"Av A Dos";"Siyah Unisex Telefon Bölmeli Taktik Çapraz Bel Çanta Göğüs Seyahet Günlük Bodybag Freebag Slingbag";"399,90 TL";"https://cdn.dsmcdn.com/mnresize/400/-/ty1814/prod/QC_ENRICHMENT/20260121/12/e2e02db9-6541-35eb-92fa-15aafd6f4dcd/1_org_zoom.jpg";"Hızlı teslimat yapılıyor!";"4.6";"25"
"Erkek";"Erkek Çanta";"KAFFAA";"Unisex Askılı Fermuarlı Cepli El Ve Omuz Çantası - Erkek Çantası - Kadın Çantası";"199,90 TL";"https://cdn.dsmcdn.com/mnresize/400/-/ty1582/prod/QC/20241013/18/11bd338f-4a61-3182-a66b-e4b1eab6ae9d/1_org_zoom.jpg";"Birlikte Al Kazan";"4.5";"416"
"Erkek";"Erkek Çanta";"LOOP DESIGN";"Unısex Çok Renkli Freebag Bel & Omuz Çantası – Fonksiyonel ve Şehir Stiline Uyumlu";"418,76 TL";"https://cdn.dsmcdn.com/mnresize/400/-/ty1826/prod/QC_PREP/20260214/16/664ecfe4-63a5-332a-9807-255d5ffe2a23/1_org_zoom.jpg";"Hızlı teslimat yapılıyor!";"4";"40"
"Erkek";"Erkek Çanta";"D'VERS";"Unisex Siyah 2 Bölmeli Omuz Ve Bel Çantası";"249,90 TL";"https://cdn.dsmcdn.com/mnresize/400/-/ty942/product/media/images/20230605/21/381366313/963409644/1/1_org_zoom.jpg";"En Çok Değerlendirilen 1. Ürün";"4.4";"3382"
"Erkek";"Erkek Çanta";"JR Boutique";"Erkek El Çantası 3 Bölmeli Suni Deri Günlük Portföy Çanta - Siyah El Organizeri";"439,34 TL";"https://cdn.dsmcdn.com/mnresize/400/-/ty1893/prod/QC_ENRICHMENT/20260507/13/3227e01b-09a3-3e29-abd8-c059d9618f16/1_org_zoom.jpg";"Hızlı teslimat yapılıyor!";"5.0";"3"
"Erkek";"Erkek Çanta";"Valiberta";"Desmond Erkek Deri El Tutmalı Çift Fermuarlı ve Cepli Seyahat & Bakım Çantası - Siyah";"461,01 TL";"https://cdn.dsmcdn.com/mnresize/400/-/ty1823/prod/QC_ENRICHMENT/20260205/10/9523ebf7-3099-3a19-af8a-cb61a5facb58/1_org_zoom.jpg";"1,2B kişi favoriledi!";"4.6";"13"
"Erkek";"Erkek Çanta";"Frank Martin";"Lizbon Orijinal Unisex Günlük Ayarlanabilir Askılı Spor Çapraz El Göğüs Ve Omuz Çantası 140-011";"302,58 TL";"https://cdn.dsmcdn.com/mnresize/400/-/ty1482/product/media/images/prod/QC/20240816/04/16d3281f-ba97-3d74-84d7-87eafa19da70/1_org_zoom.jpg";"Hızlı teslimat yapılıyor!";"4.4";"528"
"Erkek";"Erkek Çanta";"Alone";"Unisex Siyah Fonksiyonel Bel Çantası - Ayarlanabilir Omuz Çantası-6060";"470 TL";"https://cdn.dsmcdn.com/mnresize/400/-/ty1898/prod/QC_ENRICHMENT/20260511/17/4965afbc-3ac7-3544-9533-f0b251e1932d/1_org_zoom.jpg";"Başarılı Satıcı";"4";"2"
"Erkek";"Erkek Çanta";"LOOP DESIGN";"Unısex Çok Renkli Freebag Bel & Omuz Çantası – Fonksiyonel ve Şehir Stiline Uyumlu";"474,76 TL";"https://cdn.dsmcdn.com/mnresize/400/-/ty1824/prod/QC_PREP/20260214/16/d9acd4dd-661b-308c-91b4-6bf36a4da2cf/1_org_zoom.jpg";"Hızlı teslimat yapılıyor!";"4";"28"
"Erkek";"Erkek Çanta";"Newish";"Erkek Siyah Vegan Deri Portföy Traşlık El Çantası";"358,90 TL";"https://cdn.dsmcdn.com/mnresize/400/-/ty1178/product/media/images/prod/SPM/PIM/20240220/12/16daa7da-7b97-3e7e-b475-db9c6177702c/1_org_zoom.jpg";"En Çok Satan 1. Ürün";"4";"1536"
"Erkek";"Erkek Çanta";"AVCA";"Suya Dayanıklı Kulaklık Usb Çıkışlı Bel Çantası Çapraz Omuz Çanta Çapraz Askılı Göğüs Çanta";"515,71 TL";"https://cdn.dsmcdn.com/mnresize/400/-/ty1446/product/media/images/prod/QC/20240728/21/955869d9-508e-310d-866c-bbb15406d215/1_org_zoom.jpg";"Hızlı teslimat yapılıyor!";"4.7";"9"
"Erkek";"Erkek Çanta";"NEWISH POLO ACCESSORIES";"Newish Yuppy Club Keten Telefon Bölmeli Bel Ve Çapraz Omuz Çanta Göğüs Seyahet Günlük Bodybag";"335,80 TL";"https://cdn.dsmcdn.com/mnresize/400/-/ty1684/prod/QC/20250523/08/6575fb27-2efb-3919-b84a-4968a13fd63c/1_org_zoom.jpg";"En Çok Değerlendirilen 2. Ürün";"4.6";"3006"
"Erkek";"Erkek Çanta";"Telpox";"Usb Şarj Portlu ve Kilitli Omuz ve Göğüs Çantası, Şık Tasarım, Powerbank Bağlantılı";"729,18 TL";"https://cdn.dsmcdn.com/mnresize/400/-/ty1897/prod/QC_ENRICHMENT/20260517/04/21271d4d-3cbe-3003-a178-9545e94dbfda/1_org_zoom.jpg";"Hızlı teslimat yapılıyor!";"3";"83"
"Erkek";"Erkek Çanta";"Tarix";"Valiz Etiketi, Bagaj etiketi,Çanta etiket, Bavul etiketi 2 adet";"175 TL";"https://cdn.dsmcdn.com/mnresize/400/-/ty1631/prod/QC/20250131/14/4f2793d3-f8c6-3c1c-8acd-8e1a69b09f82/1_org_zoom.jpg";"Birlikte Al Kazan";"4.6";"14"
"Erkek";"Erkek Çanta";"Newish";"Erkek Siyah Vegan Deri Telefon Bölmeli Çapraz El Ve Omuz Çantası (BÜYÜK BOY)";"461,58 TL";"https://cdn.dsmcdn.com/mnresize/400/-/ty1799/prod/QC_ENRICHMENT/20251210/16/4c3acb12-03b4-39b1-809b-2dca17bf5991/1_org_zoom.jpg";"En Çok Değerlendirilen 2. Ürün";"4.6";"1367"
"Erkek";"Erkek Çanta";"POLOGRAND London";"Orijinal Unisex Çok Gözlü Su Geçirmez Spor Kurs Laptop Gezi Seyahat Ve Günlük Kullanım Sırt Çantası";"849,90 TL";"https://cdn.dsmcdn.com/mnresize/400/-/ty1904/prod/QC_ENRICHMENT/20260507/05/7c8d14aa-2a1c-37e5-8fad-b31f0adfe43e/1_org_zoom.jpg";"Birlikte Al Kazan";"4.4";"323"
"Erkek";"Erkek Çanta";"Puma";"Buzz Portable Omuz Çantası";"958,99 TL";"https://cdn.dsmcdn.com/mnresize/400/-/ty1669/prod/QC/20250427/09/66f3bba6-31eb-3ec6-a2a8-8489db0fc188/1_org_zoom.jpg";"Yetkili Satıcı";"4.9";"31"
"Erkek";"Erkek Çanta";"AVCA";"Siyah Erkek Telefon Bölmeli Taktik Bel Kemer Çanta Göğüs Seyahet Günlük Bodybag";"408,16 TL";"https://cdn.dsmcdn.com/mnresize/400/-/ty1414/product/media/images/prod/QC/20240712/01/3ea85bfc-6fca-3cf6-a19b-a3c4a90d4d12/1_org_zoom.jpg";"Hızlı teslimat yapılıyor!";"4.3";"81"
"Erkek";"Erkek Çanta";"D'VERS";"Unisex Siyah Su Geçirmez Kumaş Özellikli Bel Ve Omuz Çantası";"239,90 TL";"https://cdn.dsmcdn.com/mnresize/400/-/ty1833/prod/QC_ENRICHMENT/20260305/19/ae6b3dd6-0e9a-312d-ac5e-509a28d8d3bc/1_org_zoom.jpg";"Fenomen Seçimi";"4.5";"192"
"Erkek";"Erkek Çanta";"AVCA";"Unisex Çapraz Askılı Çanta Telefon Bölmeli Göğüs Çanta Tek Kol Omuz Bodybag";"393,21 TL";"https://cdn.dsmcdn.com/mnresize/400/-/ty564/product/media/images/20221021/13/199004991/602397606/1/1_org_zoom.jpg";"Videolu Ürün";"4.7";"35"
"Erkek";"Erkek Çanta";"Av A Dos";"Siyah Unisex Telefon Bölmeli Taktik Çapraz Bel Çanta Göğüs Seyahet Günlük Bodybag Freebag Slingbag";"399,90 TL";"https://cdn.dsmcdn.com/mnresize/400/-/ty1814/prod/QC_ENRICHMENT/20260121/12/e2e02db9-6541-35eb-92fa-15aafd6f4dcd/1_org_zoom.jpg";"Hızlı teslimat yapılıyor!";"4.6";"25"
"Erkek";"Erkek Çanta";"NEWISH POLO ACCESSORIES";"Unisex Suya Dayanıklı Keten Kumaş Siyah Telefon Cepli Çapraz Göğüs Ve Omuz Çantası";"679,90 TL";"https://cdn.dsmcdn.com/mnresize/400/-/ty1435/product/media/images/prod/QC/20240723/10/4a01c644-d7ab-3a94-9c1d-1602d9b62d3c/1_org_zoom.jpg";"Hızlı teslimat yapılıyor!";"5.0";"1"
"Erkek";"Erkek Çanta";"JR Boutique";"Erkek El Çantası Suni Deri Çift Saplı Günlük El Portföyü - Siyah Çok Amaçlı El Çantası";"364,12 TL";"https://cdn.dsmcdn.com/mnresize/400/-/ty1830/prod/QC_PREP/20260301/10/792de6fa-9a3e-3883-a71c-4164c3cae47c/1_org_zoom.jpg";"En Çok Satan 3. Ürün";"3";"18"
"Erkek";"Erkek Çanta";"Newish";"Erkek Vegan Deri Çapraz Askılı Omuz Ve Bel Çantası - Siyah";"1.149,90 TL";"https://cdn.dsmcdn.com/mnresize/400/-/ty1660/prod/QC/20250408/12/4a87080a-3f63-3caa-ab26-db644416cfc4/1_org_zoom.jpg";"En Çok Değerlendirilen 6. Ürün";"4";"1253"
"Erkek";"Erkek Çanta";"CüzCan";"Erkek Siyah Çelik Kasalı Hakiki Deri El Ve Omuz Çantası Ayarlanabilir Askılı( Orta Boy)";"631,69 TL";"https://cdn.dsmcdn.com/mnresize/400/-/ty1697/prod/QC_ENRICHMENT/20250618/12/30913103-5a8d-3a99-9876-5987ae3ec492/1_org_zoom.jpg";"En Çok Değerlendirilen 3. Ürün";"3";"1167"
"Erkek";"Erkek Çanta";"Bevitton";"Saten Suya Dayanıklı Kumaş Okul Çantası Unisex Siyah Okul Sırt Çantası 2200";"1.199 TL";"https://cdn.dsmcdn.com/mnresize/400/-/ty1835/prod/QC_ENRICHMENT/20260308/04/4eeb4638-8bb9-3049-89b0-78b31251deb5/1_org_zoom.jpg";"Fenomen Seçimi";"4.5";"252"
"Erkek";"Erkek Çanta";"Tommy Hilfiger";"Erkek Çapraz Çanta AM0AM13710BDS";"1.721,40 TL";"https://cdn.dsmcdn.com/mnresize/400/-/ty1799/prod/QC_ENRICHMENT/20251211/17/3703590a-483a-35cb-bb74-b482d3198a39/1_org_zoom.jpg";"En Çok Satan 8. Ürün";"5.0";"4"
"Erkek";"Erkek Çanta";"Av A Dos";"Siyah Telefon Bölmeli Deri Ekose Ayarlanabilir Askılı Erkek El Omuz Çanta Orta Boy";"560,34 TL";"https://cdn.dsmcdn.com/mnresize/400/-/ty1580/prod/QC/20241008/15/979ffcbf-c684-3298-a967-53647ac0bef3/1_org_zoom.jpg";"3,8B kişi favoriledi!";"2";"186"
"Erkek";"Erkek Çanta";"D'VERS";"Su Geçirmez Siyah Deri Çapraz Askılı Bel ve Omuz Çantası";"489,90 TL";"https://cdn.dsmcdn.com/mnresize/400/-/ty1594/prod/QC/20241028/03/5833baae-15ab-34c4-87c3-ca39acc10f02/1_org_zoom.jpg";"Birlikte Al Kazan";"4.6";"248"
"Erkek";"Erkek Çanta";"Mark Ryden";"ODYSSEY Laptop Siyah Renk Sırt Çantası Kilitli Usb Şarj Kitli Çanta MR9116_00";"4.999 TL";"https://cdn.dsmcdn.com/mnresize/400/-/ty1549/prod/QC/20240916/11/8c32f999-e530-3ada-9679-f3a9174e324b/1_org_zoom.jpg";"Yetkili Satıcı";"4.7";"43"
"Erkek";"Erkek Çanta";"SEVENTEEN";"Çapraz Sırt Omuz Göğüs Su Geçirmez Askılı Unisex Siyah Çanta 4926";"559 TL";"https://cdn.dsmcdn.com/mnresize/400/-/ty532/product/media/images/20220912/10/174206764/567737341/1/1_org_zoom.jpg";"Başarılı Satıcı";"4.7";"1675"
"Erkek";"Erkek Çanta";"Av A Dos";"Siyah Telefon Bölmeli Deri Ekose Ayarlanabilir Askılı Erkek El Omuz Çanta Orta Boy";"561,32 TL";"https://cdn.dsmcdn.com/mnresize/400/-/ty1538/product/media/images/prod/QC/20240911/15/7a614f75-0193-3a53-bd39-26063b8321ef/1_org_zoom.jpg";"Fenomen Seçimi";"2";"269"
"Erkek";"Erkek Çanta";"Newish Polo";"Unisex Deri Çapraz Askılı Çanta Göğüs Çanta Çift Yönlü Omuz Çanta Kulaklık Çıkışlı Bodybag Günlük";"421,22 TL";"https://cdn.dsmcdn.com/mnresize/400/-/ty1633/prod/QC/20250207/00/cde845f7-0b09-326f-87ff-011af6a1c6a3/1_org_zoom.jpg";"Birlikte Al Kazan";"5";"1016"
"Erkek";"Erkek Çanta";"AVCA";"Uniseks Kabuk Korumalı Suya Dayanıklı Motorcu Bacak Çapraz Omuz Bel Çantası";"590,16 TL";"https://cdn.dsmcdn.com/mnresize/400/-/ty1788/prod/QC_ENRICHMENT/20251114/16/a20a8750-471f-318d-a883-22e083ebe8b8/1_org_zoom.jpg";"Hızlı teslimat yapılıyor!";"5.0";"8"
"Erkek";"Erkek Çanta";"Newish";"Erkek Siyah Vegan Deri Suya Dayanıklı Elegan Portföy Stil El Çantası Traş Kozmetik Çanta";"589,90 TL";"https://cdn.dsmcdn.com/mnresize/400/-/ty1748/prod/QC_ENRICHMENT/20250909/13/40add2f6-ff2a-3995-85bd-d3f7639ba9e2/1_org_zoom.jpg";"En Çok Satan 4. Ürün";"2";"570"
"Erkek";"Erkek Çanta";"Newish";"Erkek Deri El Ve Omuz Çantası, Çapraz Çanta Günlük Kulanım Siyah Renk (ORTA BOY). Telefon Bölmeli";"517,42 TL";"https://cdn.dsmcdn.com/mnresize/400/-/ty1631/prod/QC/20250130/10/b80af120-4b88-3fb3-914d-6254d8a86981/1_org_zoom.jpg";"Hızlı teslimat yapılıyor!";"5";"140"
"Erkek";"Erkek Çanta";"MUJGAN";"Gri Powerbank Özellikli Şifreli Çanta";"659,99 TL";"https://cdn.dsmcdn.com/mnresize/400/-/ty1779/prod/QC_ENRICHMENT/20251025/11/3d92ac88-60e6-3a5f-8186-460c0945d1eb/1_org_zoom.jpg";"Hızlı teslimat yapılıyor!";"4.2";"97"
"Erkek";"Erkek Çanta";"Mark Ryden";"Clear Tek Kol Omuz Çantası Ipad Tablet Uyumlu Mr8518_00";"829,99 TL";"https://cdn.dsmcdn.com/mnresize/400/-/ty1553/prod/QC/20240917/14/9f2a8f70-12c5-3625-8742-b6166bffb65e/1_org_zoom.jpg";"726 kişi favoriledi!";"4.8";"20"
"Erkek";"Erkek Çanta";"Sofia";"Unisex Kadın Erkek Günlük Üniversite Hediye Fermuarlı Omuz El ve Bel Askılı Çanta";"270 TL";"https://cdn.dsmcdn.com/mnresize/400/-/ty1893/prod/QC_ENRICHMENT/20260508/15/2df638ab-f1b9-3a5e-8a9e-55e07e70cf7c/1_org_zoom.jpg";"Hızlı teslimat yapılıyor!";"5.0";"3"
"Erkek";"Erkek Çanta";"Av A Dos";"Deri Çapraz Askılı Çanta Göğüs Çanta Çok Bölmeli Tek Kol Omuz Çanta Kulaklık Çıkışlı Bodybag";"558,50 TL";"https://cdn.dsmcdn.com/mnresize/400/-/ty1738/prod/QC_ENRICHMENT/20250829/16/6b433b4e-969a-308f-a0c1-1ac67191baa7/1_org_zoom.jpg";"8,7B kişi favoriledi!";"4.6";"414"
"Erkek";"Erkek Çanta";"AVCA";"Unisex Oxfort Kumaş Telefon Bölmeli Bel Ve Çapraz Omuz Çanta Göğüs Seyahet Günlük Bodybag";"371,43 TL";"https://cdn.dsmcdn.com/mnresize/400/-/ty1506/product/media/images/prod/QC/20240827/18/1327d788-613f-3703-b35a-d7b70d525897/1_org_zoom.jpg";"Videolu Ürün";"4.5";"185"
"Erkek";"Erkek Çanta";"AVCA";"Unisex Suya Dayanıklı Kanvas Usb Kulaklık Çıkışlı Çapraz Askılı Bel Omuz Çanta Göğüs Günlük Bodybag";"546,84 TL";"https://cdn.dsmcdn.com/mnresize/400/-/ty1414/product/media/images/prod/QC/20240712/01/eef7912d-5cc5-3916-ac2b-23b9c39afbcf/1_org_zoom.jpg";"Videolu Ürün";"4.5";"20"
"Erkek";"Erkek Çanta";"NEWISH POLO ACCESSORIES";"Unisex Siyah Su Geçirmez Usb Ve Kulaklık Girişli Bel Ve Omuz Çanta Freebag";"356,92 TL";"https://cdn.dsmcdn.com/mnresize/400/-/ty1363/product/media/images/prod/QC/20240613/16/eeb5b79a-8c10-349a-9152-d92c2fbf1a29/1_org_zoom.jpg";"Videolu Ürün";"3";"633"
"Erkek";"Erkek Çanta";"Louise Motto";"Nexus - %100 Hakiki Deri Unisex El Çantası - Erkek & Kadın Için En Iyi Hediye - Siyah";"2.085,60 TL";"https://cdn.dsmcdn.com/mnresize/400/-/ty1523/product/media/images/prod/QC/20240903/11/afaa8612-1324-3cbe-91b1-db915552ae47/1_org_zoom.jpg";"Hızlı teslimat yapılıyor!";"4";"287"
"Erkek";"Erkek Çanta";"Defacto";"Erkek Çapraz Çanta G4036AXNS";"639,99 TL";"https://cdn.dsmcdn.com/mnresize/400/-/ty1857/prod/QC_PREP/20260421/14/9df1a4fb-2caa-3b6c-a190-70ffb79e2158/1_org_zoom.jpg";"N/A";"2";"2"
"Erkek";"Erkek Çanta";"Zaman Kutusu";"Erkek Siyah Vegan Deri Suya Dayanıklı Stil El Çantası, Kemer, Cüzdan ve Kartlık Seti";"799 TL";"https://cdn.dsmcdn.com/mnresize/400/-/ty1846/prod/QC_PREP/20260326/15/73ab3346-f8fd-383a-9f99-7e33adcb2fb5/1_org_zoom.jpg";"Hızlı teslimat yapılıyor!";"5.0";"1"
"Erkek";"Erkek Çanta";"U.S. Polo Assn.";"Traş Çantası PLTRŞ8378";"899 TL";"https://cdn.dsmcdn.com/mnresize/400/-/ty1926/prod/QC_ENRICHMENT/20260516/15/a46ea0cc-06c0-3120-9207-be3f0e404fd6/1_org_zoom.jpg";"En Çok Ziyaret Edilen 9. Ürün";"4.4";"325"
"Erkek";"Erkek Çanta";"KAFT";"Unisex Dikey Postacı Çantası - Methone - Concrete";"3.090 TL";"https://cdn.dsmcdn.com/mnresize/400/-/ty1644/prod/QC/20250305/12/71839e36-5768-30f6-b00c-23c9ab96b317/1_org_zoom.jpg";"Başarılı Satıcı";"4";"12"
"Erkek";"Erkek Çanta";"D'VERS";"Su İtici Kumaş ve Fermuar Özellikli Siyah Çapraz Askılı Bel ve Omuz Çantası";"469,23 TL";"https://cdn.dsmcdn.com/mnresize/400/-/ty1648/prod/QC/20250307/11/121401d2-cb96-3294-a07a-5c67d1b80e6f/1_org_zoom.jpg";"Birlikte Al Kazan";"4.6";"62"
"Erkek";"Erkek Çanta";"Newish Polo";"Erkek Hakiki Deri El ve Omuz Çantası - Siyah";"999,90 TL";"https://cdn.dsmcdn.com/mnresize/400/-/ty1630/prod/QC/20250128/17/e3704a10-e804-32b0-9347-269b54b9c15e/1_org_zoom.jpg";"Hızlı teslimat yapılıyor!";"4.6";"54"
"Erkek";"Erkek Çanta";"Mavi";"Pro Detaylı Siyah Bel Çantası 0911566-900";"999,99 TL";"https://cdn.dsmcdn.com/mnresize/400/-/ty1940/prod/QC_ENRICHMENT/20260511/03/231e11d1-c08b-3201-ada5-dadcf5d83677/1_org_zoom.jpg";"1,5B kişi favoriledi!";"4.9";"36"
"Erkek";"Erkek Çanta";"Arctic Hunter";"Omuz Bel Çantası Suya Dayanıklı Ergonomik Ultra Hafif Geniş 9.7inç Çanta";"692,82 TL";"https://cdn.dsmcdn.com/mnresize/400/-/ty1639/prod/QC/20250218/09/0da6aa77-c395-3f18-9ce1-cf82367c54d5/1_org_zoom.jpg";"N/A";"4.7";"12"
"Erkek";"Erkek Çanta";"Newish";"Erkek Siyah Büyük Boy El Ve Omuz Çantası, Çapraz Çanta Günlük Kullanım Siyah";"539,90 TL";"https://cdn.dsmcdn.com/mnresize/400/-/ty1591/prod/QC/20241023/09/edbc7f53-1ce5-308b-985f-f548ee5b7f62/1_org_zoom.jpg";"En Çok Satan 9. Ürün";"2";"384"
"Erkek";"Erkek Çanta";"Zaman Kutusu";"Erkek Siyah Vegan Deri Suya Dayanıklı Portföy Stil Modern El Çantası";"576,22 TL";"https://cdn.dsmcdn.com/mnresize/400/-/ty1826/prod/QC_PREP/20260216/11/10b0201c-72b4-3604-a250-e96bb35dde4c/1_org_zoom.jpg";"Birlikte Al Kazan";"5.0";"2"
"Erkek";"Erkek Çanta";"adidas";"Essentials Bej Omuz Çantası (KA1479)";"899,34 TL";"https://cdn.dsmcdn.com/mnresize/400/-/ty1833/prod/QC_PREP/20260306/11/a8c451cb-6897-3a94-a26d-4b063fa99456/1_org_zoom.jpg";"Yetkili Satıcı";"5.0";"7"
"Erkek";"Erkek Çanta";"AVCA";"Siyah Telefon Bölmeli Deri Ekose Ayarlanabilir Askılı Erkek El Omuz Çanta Orta Boy";"557,01 TL";"https://cdn.dsmcdn.com/mnresize/400/-/ty1593/prod/QC/20241030/15/9524fb97-348d-3658-861b-de96a4cd4008/1_org_zoom.jpg";"Hızlı teslimat yapılıyor!";"5.0";"1"
"Erkek";"Erkek Çanta";"Leyl";"Kulaklık Çıkışlı Kanvas Erkek Göğüs Çantası Çapraz Tek Kol Suya Dayanıklı Omuz Çanta";"408,81 TL";"https://cdn.dsmcdn.com/mnresize/400/-/ty453/product/media/images/20220614/13/125530374/233844381/1/1_org_zoom.jpg";"Hızlı teslimat yapılıyor!";"4.6";"90"
"Erkek";"Erkek Çanta";"KAFT";"Unisex Dikey Postacı Çantası - Methone - Brick";"3.090 TL";"https://cdn.dsmcdn.com/mnresize/400/-/ty1646/prod/QC/20250305/12/c5c518ce-4b2b-374e-b3d3-6c6ad438e467/1_org_zoom.jpg";"Başarılı Satıcı";"4";"17"
"Erkek";"Erkek Çanta";"Calvin Klein";"Erkek Siyah Seyahat Çantası";"2.361,75 TL";"https://cdn.dsmcdn.com/mnresize/400/-/ty1934/prod/QC_ENRICHMENT/20260516/18/d69c256d-4968-3dfe-b699-d30088558e41/1_org_zoom.jpg";"En Çok Ziyaret Edilen 8. Ürün";"4.4";"53"
"Erkek";"Erkek Çanta";"Arctic Hunter";"Çift Gözlü, Iç Organizerli Bel Çantası Y00565";"809,66 TL";"https://cdn.dsmcdn.com/mnresize/400/-/ty1712/prod/QC_ENRICHMENT/20250717/04/54dbcc3e-b9f6-31f0-aad4-9325eef499d5/1_org_zoom.jpg";"Videolu Ürün";"5.0";"4"
"Erkek";"Erkek Çanta";"Av A Dos";"Siyah Telefon Bölmeli Deri Ekose Ayarlanabilir Askılı Erkek El Omuz Çanta Orta Boy";"560,34 TL";"https://cdn.dsmcdn.com/mnresize/400/-/ty1580/prod/QC/20241008/15/979ffcbf-c684-3298-a967-53647ac0bef3/1_org_zoom.jpg";"3,8B kişi favoriledi!";"2";"186"
"Erkek";"Erkek Çanta";"NahitaTyana";"Siyah Hakiki Deri Erkek Tıraş el Portföy&Clutch Bakım Çantası Çift Gözlü";"823,98 TL";"https://cdn.dsmcdn.com/mnresize/400/-/ty1829/prod/QC_PREP/20260219/03/bcc1a835-cd51-34bb-b765-0d9027439d4c/1_org_zoom.jpg";"Birlikte Al Kazan";"4.2";"12"
"Erkek";"Erkek Çanta";"Puma";"Academy Portable Siyah Unisex Omuz Çantası 091488-01";"950 TL";"https://cdn.dsmcdn.com/mnresize/400/-/ty1739/prod/QC_PREP/20250824/12/bdffac37-5950-3985-a098-ae800eec8c94/1_org_zoom.jpg";"Hızlı teslimat yapılıyor!";"4";"78"
"Erkek";"Erkek Çanta";"Newish Polo";"Erkek Suya Dayanıklı Keten Kumaş Telefon Bölmeli Mini Omuz Çantası Çapraz Çanta Günlük Siyah Renk";"344 TL";"https://cdn.dsmcdn.com/mnresize/400/-/ty1700/prod/QC_ENRICHMENT/20250624/09/96a19a69-0a1a-38a7-9179-ab806e4fba51/1_org_zoom.jpg";"Yetkili Satıcı";"2";"258"
"Erkek";"Erkek Çanta";"Torz";"Kanvas Erkek El Çantası Omuz Askılı Cüzdan Telefon Için Günlük Çanta (ORTA BOY)";"433,66 TL";"https://cdn.dsmcdn.com/mnresize/400/-/ty1330/product/media/images/prod/QC/20240526/01/fdaa551d-322a-39f2-bf62-9883503946cf/1_org_zoom.jpg";"Hızlı teslimat yapılıyor!";"4.5";"140"
"Erkek";"Erkek Çanta";"derius";"Çelik Kasalı Küçük Boy Siyah Yatay Erkek El Ve Omuz Çantası (HAKİKİ DERİ)";"783,20 TL";"https://cdn.dsmcdn.com/mnresize/400/-/ty1680/prod/QC/20250522/22/76178542-f199-3715-9031-d4002d8807a0/1_org_zoom.jpg";"Hızlı teslimat yapılıyor!";"5.0";"2"
"Erkek";"Erkek Çanta";"Puma";"Plus Waist Bag Unisex Siyah Günlük Stil Bel Çantası 09118401";"1.199 TL";"https://cdn.dsmcdn.com/mnresize/400/-/ty1739/prod/QC_PREP/20250829/13/048fea06-4c66-309d-86ac-da20105a8eab/1_org_zoom.jpg";"2,6B kişi favoriledi!";"3";"52"
"Erkek";"Erkek Çanta";"Alone";"Sırt Çantası – 15.6 Laptop Bölmeli, Suya Dayanıklı Okul ve Seyahat Çantası, Siyah, Unisex";"1.410 TL";"https://cdn.dsmcdn.com/mnresize/400/-/ty1933/prod/QC_ENRICHMENT/20260507/12/22e31c9e-bba9-3eab-9c06-ffc3feb36390/1_org_zoom.jpg";"Başarılı Satıcı";"N/A";"0"
"Erkek";"Erkek Çanta";"D'VERS";"Unisex Siyah Süet 3 Bölmeli Çapraz Omuz Ve Bel Çantası";"283,65 TL";"https://cdn.dsmcdn.com/mnresize/400/-/ty504/product/media/images/20220812/18/158662987/542606619/1/1_org_zoom.jpg";"Birlikte Al Kazan";"4.4";"69"
"Erkek";"Erkek Çanta";"NahitaTyana";"Hakiki Deri Erkek El Çantası, Omuz  Çantası, Çapraç Çanta, Evrak Çantası";"1.713,99 TL";"https://cdn.dsmcdn.com/mnresize/400/-/ty1630/prod/QC/20250125/15/0ee5d11e-76d5-36c4-8f47-b53bec4adbe5/1_org_zoom.jpg";"Hızlı teslimat yapılıyor!";"3";"67"
"Erkek";"Erkek Çanta";"Newish";"Erkek Siyah Vegan Deri Kulaklık Çıkışlı Çapraz Omuz Çantası Bel Çantası Günlük Çanta";"433,85 TL";"https://cdn.dsmcdn.com/mnresize/400/-/ty1699/prod/QC_ENRICHMENT/20250624/09/b7fb4ba9-eda8-3500-abd5-2d907f00a4b0/1_org_zoom.jpg";"Fenomen Seçimi";"4";"977"
"Erkek";"Erkek Çanta";"Newish Polo";"Erkek Kanvas Kumaş Usb Çıkışlı Çapraz Bel ve Omuz Çantası";"1.049,90 TL";"https://cdn.dsmcdn.com/mnresize/400/-/ty1659/prod/QC/20250408/17/ba3bea3d-26ee-39ec-9de8-1867ba1705b4/1_org_zoom.jpg";"Hızlı teslimat yapılıyor!";"3";"7"
"Erkek";"Erkek Çanta";"Newish";"Erkek Vegan Deri Çapraz Askılı Omuz Ve Bel Çantası - Siyah";"1.149,90 TL";"https://cdn.dsmcdn.com/mnresize/400/-/ty1660/prod/QC/20250408/12/4a87080a-3f63-3caa-ab26-db644416cfc4/1_org_zoom.jpg";"En Çok Değerlendirilen 6. Ürün";"4";"1253"
"Erkek";"Erkek Çanta";"LOOP DESIGN";"Unisex Ayarlanabilir Askılı Çanta,free Bag,unisex Crossbody Sling 4 Gözlü Göğüs Ve Bel Çanta";"299,99 TL";"https://cdn.dsmcdn.com/mnresize/400/-/ty1610/prod/QC/20241204/11/7dc85fee-b095-33ce-b6b6-4c0893684b36/1_org_zoom.jpg";"Hızlı teslimat yapılıyor!";"3";"20"
"Erkek";"Erkek Çanta";"NEWISH POLO ACCESSORIES";"Newish Polo Unisex Su Geçirmez Çapraz Askılı Bel Omuz Göğüs Ve Spor Çanta Günlük Bodybag Tek Kol";"401,42 TL";"https://cdn.dsmcdn.com/mnresize/400/-/ty880/product/media/images/20230513/0/347829428/581943036/1/1_org_zoom.jpg";"Başarılı Satıcı";"4";"126"
"Erkek";"Erkek Çanta";"Alone";"Unisex Mint Fonksiyonel Bel Çantası - Ayarlanabilir Omuz Çantası-6060";"470 TL";"https://cdn.dsmcdn.com/mnresize/400/-/ty1917/prod/QC_ENRICHMENT/20260511/17/b3defa64-74da-3462-88cc-c42e3b67679d/1_org_zoom.jpg";"Başarılı Satıcı";"4";"2"
